{
  "schema_version": 1,
  "source_files": [
    "AGENTS.md",
    "SPEC.md",
    "note.md",
    "docs/rfcs/001-semantic-interactions.md"
  ],
  "goal": "Ship Melt v0.1 on Linux: JSON schema, compiler, workspace service, Python SDK and runner, revision-checked atomic changes, durable publication, and restart recovery. Prove the complete sales workflow through a command-line harness without a model. Then add the RFC 001 semantic-interaction extension as a separate language version, keeping v0.1 behavior unchanged, before the native macOS round.",
  "tasks": [
    {
      "id": "T001",
      "title": "Pin Linux toolchain and scaffold packages",
      "priority": 1,
      "status": "done",
      "details": "Scaffold python/melt (schema, sdk, runner), runtime (compiler, workspace, execution, storage), protocol, fixtures/{valid,invalid,sales}, and tests/{contract,recovery,native,integration} per SPEC.md section 17. Pin python3 and all dependencies (pydantic, pyarrow, pandas, matplotlib, pytest) with a lockfile. Provide one command that runs the full test suite. Building and testing require no macOS or Apple tools.",
      "files": [
        ".gitignore",
        "Makefile",
        "README.md",
        "fixtures/README.md",
        "fixtures/invalid/README.md",
        "fixtures/sales/README.md",
        "fixtures/valid/README.md",
        "protocol/generated/README.md",
        "protocol/schema/README.md",
        "pyproject.toml",
        "python/melt/__init__.py",
        "python/melt/__main__.py",
        "python/melt/py.typed",
        "python/melt/runner/__init__.py",
        "python/melt/schema/__init__.py",
        "python/melt/schema/canonical.py",
        "python/melt/schema/commands.py",
        "python/melt/schema/document.py",
        "python/melt/schema/limits.py",
        "python/melt/schema/records.py",
        "python/melt/sdk/__init__.py",
        "runtime/__init__.py",
        "runtime/compiler/__init__.py",
        "runtime/execution/__init__.py",
        "runtime/storage/__init__.py",
        "runtime/workspace/__init__.py",
        "scripts/check.sh",
        "tests/conftest.py",
        "tests/contract/test_cli.py",
        "tests/contract/test_scaffold.py",
        "tests/contract/test_toolchain.py",
        "tests/integration/test_pinned_stack.py",
        "tests/native/test_native_round2.py",
        "tests/recovery/test_restart_recovery.py",
        "uv.lock"
      ],
      "updated_at": "2026-10-17T22:11:50Z",
      "unblock_when": "\"\""
    },
    {
      "id": "T002",
      "title": "Probe Pi Durable storage and SQLite durability",
      "priority": 1,
      "status": "done",
      "details": "External prerequisite. Probe the pinned Pi Durable storage adapter on Linux with integration tests for atomic updates and committed observation (SPEC.md section 14). Verify synchronous=FULL on the owning connection. Record the tested filesystem and crash model. Resolve adapter gaps before any competing persistence path is implemented.",
      "depends_on": [
        "T001"
      ],
      "files": [
        ".gitignore",
        "Makefile",
        "README.md",
        "runtime/storage/pi_adapter/README.md",
        "runtime/storage/pi_adapter/package-lock.json",
        "runtime/storage/pi_adapter/package.json",
        "runtime/storage/pi_adapter/pi_storage.mjs",
        "runtime/storage/pi_adapter/probe.mjs",
        "runtime/storage/pi_adapter/probe_worker.mjs",
        "scripts/check.sh",
        "tests/integration/test_pi_durable_storage.py"
      ],
      "updated_at": "2026-10-17T22:39:09Z",
      "unblock_when": "\"\""
    },
    {
      "id": "T003",
      "title": "Implement document and command schema models",
      "priority": 1,
      "status": "done",
      "details": "Author Pydantic models for the melt/v0.1 document and its persisted records (SPEC.md sections 4 through 10 and 17). Reject unknown fields, duplicate keys, non-finite numbers, unsafe integers, and invalid IDs. Enforce the default limits. Implement RFC 8785 canonical hashing with conformance fixtures. Version the record schemas for RunRecord, RegistrationRecord, ArtifactRecord, ParameterState, CommandReceipt, Snapshot, ChangeNotification, PageRequest, and PageResponse.",
      "depends_on": [
        "T001"
      ],
      "files": [
        "README.md",
        "python/melt/schema/__init__.py",
        "python/melt/schema/canonical.py",
        "python/melt/schema/commands.py",
        "python/melt/schema/diagnostics.py",
        "python/melt/schema/document.py",
        "python/melt/schema/limits.py",
        "python/melt/schema/records.py",
        "runtime/storage/pi_adapter/README.md",
        "runtime/storage/pi_adapter/probe.mjs",
        "tests/conftest.py",
        "tests/contract/jcs/README.md",
        "tests/contract/jcs/expected-arrays.json",
        "tests/contract/jcs/expected-french.json",
        "tests/contract/jcs/expected-structures.json",
        "tests/contract/jcs/expected-unicode.json",
        "tests/contract/jcs/expected-values.json",
        "tests/contract/jcs/expected-weird.json",
        "tests/contract/jcs/input-arrays.json",
        "tests/contract/jcs/input-french.json",
        "tests/contract/jcs/input-structures.json",
        "tests/contract/jcs/input-unicode.json",
        "tests/contract/jcs/input-values.json",
        "tests/contract/jcs/input-weird.json",
        "tests/contract/test_canonical.py",
        "tests/contract/test_commands.py",
        "tests/contract/test_document.py",
        "tests/contract/test_limits.py",
        "tests/contract/test_records.py",
        "tests/integration/test_pi_durable_storage.py"
      ],
      "updated_at": "2026-10-17T22:52:17Z",
      "unblock_when": "\"\""
    },
    {
      "id": "T004",
      "title": "Build valid and invalid contract fixtures",
      "priority": 1,
      "status": "done",
      "details": "Create fixtures under fixtures/valid and fixtures/invalid per SPEC.md section 18.1. Each invalid fixture carries an expected diagnostic code and JSON Pointer. Cover unknown fields, duplicate keys, invalid IDs, unsupported versions, non-finite numbers, unsafe integers, invalid defaults, wrong parameter types, missing source versions, missing controls, renderer mismatches, layout errors, competing writers, incomplete mappings, invalid migrations, missing expected revisions, registry mismatches, and artifact schema drift. Valid fixtures include the empty workspace, every projection kind, hidden panes, nullable parameters, a state migration, and the full sales example with a real artifact hash.",
      "depends_on": [
        "T003"
      ],
      "files": [
        "Makefile",
        "README.md",
        "fixtures/README.md",
        "fixtures/catalog.json",
        "fixtures/invalid/README.md",
        "fixtures/invalid/artifact-schema-drift.json",
        "fixtures/invalid/commands/invalid-state-migration.json",
        "fixtures/invalid/commands/missing-expected-revision.json",
        "fixtures/invalid/competing-writers.json",
        "fixtures/invalid/duplicate-key.json",
        "fixtures/invalid/incomplete-mapping.json",
        "fixtures/invalid/invalid-default.json",
        "fixtures/invalid/invalid-id.json",
        "fixtures/invalid/layout-duplicate-placement.json",
        "fixtures/invalid/layout-excessive-depth.json",
        "fixtures/invalid/layout-invalid-ratio.json",
        "fixtures/invalid/layout-missing-pane.json",
        "fixtures/invalid/manifest.json",
        "fixtures/invalid/missing-control.json",
        "fixtures/invalid/missing-source-version.json",
        "fixtures/invalid/non-finite-number.json",
        "fixtures/invalid/registry-mismatch.json",
        "fixtures/invalid/renderer-mismatch.json",
        "fixtures/invalid/unknown-field.json",
        "fixtures/invalid/unsafe-integer.json",
        "fixtures/invalid/unsupported-version.json",
        "fixtures/invalid/wrong-parameter-type.json",
        "fixtures/sales/README.md",
        "fixtures/sales/notes.md",
        "fixtures/sales/revenue.png",
        "fixtures/sales/sales.parquet",
        "fixtures/valid/README.md",
        "fixtures/valid/commands/state-migration.json",
        "fixtures/valid/document-hashes.json",
        "fixtures/valid/empty-workspace.json",
        "fixtures/valid/hidden-panes.json",
        "fixtures/valid/nullable-parameters.json",
        "fixtures/valid/projection-document.json",
        "fixtures/valid/projection-plot.json",
        "fixtures/valid/projection-table.json",
        "fixtures/valid/sales-full.json",
        "scripts/build_fixture_artifacts.py",
        "tests/contract/test_fixtures.py"
      ],
      "updated_at": "2026-10-17T23:09:49Z",
      "unblock_when": "\"\""
    },
    {
      "id": "T005",
      "title": "Implement compiler stages, plans, and diagnostics",
      "priority": 1,
      "status": "done",